rule_id,sbc_ref,detection_type,rule_text,cv_target,category,priority
MO-001,717:51-4.1,LABEL,"A permanent notice of durable material shall be fixed to the mobile/transportable unit in a prominent position, preferably adjacent to the supply inlet connector, stating the type of supply, voltage rating, number of phases, earthing arrangement, and maximum power.",Permanent rating notice adjacent to supply inlet connector on mobile unit,Mobile,HIGH
MO-002,717:51-4.1,LABEL,"For socket-outlets individually protected by electrical separation in mobile units, a durable indication shall be located adjacent to these socket-outlets stating that only one item of equipment shall be connected to each socket-outlet.",Warning label at electrically separated socket-outlets: 'one item of equipment only',Mobile,MEDIUM
MO-003,717:55-6.5.1.1,CONDITION,Plugs on mobile/transportable units shall have an enclosure of insulating material. Plugs and socket-outlets located outside shall afford IP44. Appliance inlets shall provide at least IP55.,"Insulating plug enclosure, IP44 socket-outlets, IP55 appliance inlets on mobile unit",Mobile,HIGH
MO-004,717:52-1.11,CONDITION,The flexible cable connecting a mobile unit to supply shall enter the unit by an insulating inlet minimizing insulation damage risk. The cable sheath shall be firmly gripped by the cable gland or anchored to prevent stress on the termination.,Insulating cable inlet and firmly gripped/anchored cable gland on mobile unit,Mobile,HIGH
MO-005,717:31-2.2.1,ABSENCE,The use of the TN-C system is not permitted inside any mobile or transportable unit.,Absence of TN-C system inside mobile/transportable unit,Mobile,MEDIUM
MO-006,717:55-6.5.1.1,POSITION,The plug part for connecting the mobile/transportable unit to the supply shall be situated on the unit.,Supply plug situated on the mobile/transportable unit itself,Mobile,MEDIUM
